Edition,Country,Stadium_Count,Stadium_Cost_USD_Billion,Total_Budget_USD_Billion,Key_Infrastructures,Economic_Impact_USD_Billion,Jobs_Created,Legacy_Issues
2006,Germany,12,1.6,4.3,"Transport, Telecoms, Security",0.0,0,"Stadiums well used by clubs, limited local economic impact"
2010,South Africa,10,1.3,4.5,"Airports, Roads, Telecoms, Energy",3.1,130000,"Underutilized stadiums, high maintenance costs"
2014,Brazil,12,4.8,15.7,"Airports, Urban mobility, Telecoms, Ports",13.6,1000000,"Low project execution, white elephants, social protests"
2018,Russia,12,4.22,11.0,"Airports, Roads, Metro, Hospitals, Hotels",13.8,220000,"Durable infrastructures, stadiums reused"
2022,Qatar,8,4.3,220.0,"Metro, Roads, Lusail city, Energy, Hotels",20.0,1500000,"Massive legacy, profitability and sustainability debates"
